<?xml version="1.0" encoding="UTF-8"?>
<musica xmlns:xsi="http://www.w3.org/2001/XMLSchema-instance"
    xsi:noNamespaceSchemaLocation="musica.xsd">

    <grupo name="1">
        <nombre>Green Day</nombre>
        <genero>pop</genero>
        <contacto>
            <email>press@crushmusic.com</email>
            <facebook>https://www.facebook.com/GreenDay/</facebook>
            <instagram>https://www.instagram.com/greenday</instagram>
            <x>https://x.com/greenday</x>
        </contacto>
        <web>https://www.greendayofficial.com</web>
        <integrantes>
            <integrante funcion="vocalista">
                <nombre>Billie Joe Armstrong</nombre>
                <edad>52</edad>
            </integrante>
            <integrante funcion="bajo">
                <nombre>Mike Dirnt</nombre>
                <edad>51</edad>
            </integrante>
            <integrante funcion="bateria">
                <nombre>Tre Cool</nombre>
                <edad>50</edad>
            </integrante>
        </integrantes>
    </grupo>

    <grupo name="2">
        <nombre>Soda Estereo</nombre>
        <genero>pop</genero>
        <contacto>
            <email>tour@sodastereo.com</email>
            <facebook>https://www.facebook.com/sodastereo/?locale=es_ES</facebook>
            <instagram>https://www.instagram.com/sodastereo</instagram>
            <x>https://x.com/sodastereo</x>
        </contacto>
        <web>https://www.sodastereooficial.com</web>
        <integrantes>
            <integrante funcion="vocalista">
                <nombre>Gustavo Cerati</nombre>
                <edad>55</edad>
            </integrante>
            <integrante funcion="bajo">
                <nombre>Zeta Bosio</nombre>
                <edad>68</edad>
            </integrante>
            <integrante funcion="bateria">
                <nombre>Charly Alberti</nombre>
                <edad>62</edad>
            </integrante>
        </integrantes>
    </grupo>

</musica>